{
 "version": "bp-assembly-v1",
 "target": "wing_long_range",
 "fasteners": [
  {
   "id": "F1",
   "standard": "M3",
   "kind": "screw",
   "length_mm": 8,
   "qty": 4,
   "anchor": "face_+Y",
   "joins": [
    "new-005",
    "new-001"
   ],
   "hole": "clearance",
   "torque_Ncm": 50,
   "note": "wing-root key fix (boss f-wing-root-key)"
  },
  {
   "id": "F2",
   "standard": "M3",
   "kind": "screw",
   "length_mm": 6,
   "qty": 2,
   "anchor": "face_+X",
   "joins": [
    "new-002",
    "new-001"
   ],
   "hole": "clearance",
   "torque_Ncm": 40,
   "note": "removable sensor nose / pitot boom module"
  },
  {
   "id": "F3",
   "standard": "PIN2",
   "kind": "pin",
   "length_mm": 12,
   "qty": 2,
   "anchor": "face_+Y",
   "joins": [
    "new-005",
    "new-001"
   ],
   "hole": "through",
   "note": "elevon hinge service"
  }
 ],
 "joints": [
  {
   "id": "J1",
   "partA": "new-005",
   "partB": "new-001",
   "mate": "press",
   "clearance_mm": 0.2,
   "note": "wing-root spar key ↔ center spine"
  },
  {
   "id": "J2",
   "partA": "new-002",
   "partB": "new-001",
   "mate": "slot",
   "clearance_mm": 0.25,
   "note": "sensor nose module"
  },
  {
   "id": "J3",
   "partA": "new-003",
   "partB": "new-001",
   "mate": "slot",
   "clearance_mm": 0.3,
   "note": "mission payload / battery CG rail slide"
  },
  {
   "id": "J4",
   "partA": "new-005",
   "partB": "new-001",
   "mate": "pin",
   "clearance_mm": 0.2,
   "note": "elevon hinge rotation"
  },
  {
   "id": "J5",
   "partA": "new-004",
   "partB": "new-001",
   "mate": "face",
   "clearance_mm": 0.2,
   "note": "propulsion-display and rear cable module mounts to center spine rear pylon"
  }
 ],
 "hardware_bom": [
  {
   "standard": "M3",
   "qty": 6
  },
  {
   "standard": "PIN2",
   "qty": 2
  }
 ]
}