{
 "version": "bp-assembly-v1",
 "target": "arm_6dof",
 "fasteners": [
  {
   "id": "F1",
   "standard": "M4",
   "kind": "bolt",
   "length_mm": 12,
   "qty": 4,
   "anchor": "corners_4",
   "joins": [
    "new-001"
   ],
   "hole": "tap",
   "torque_Ncm": 120,
   "note": "J1 base mount (shoulder cartridge set)"
  },
  {
   "id": "F2",
   "standard": "M3",
   "kind": "screw",
   "length_mm": 8,
   "qty": 6,
   "anchor": "corners_4",
   "joins": [
    "new-003",
    "new-002"
   ],
   "hole": "clearance",
   "torque_Ncm": 50,
   "note": "J3/J5/J6 removable joint cartridges → link"
  },
  {
   "id": "F3",
   "standard": "M3",
   "kind": "bolt",
   "length_mm": 10,
   "qty": 4,
   "anchor": "face_+Z",
   "joins": [
    "new-004"
   ],
   "hole": "clearance",
   "torque_Ncm": 60,
   "note": "tool flange bolt pattern"
  }
 ],
 "joints": [
  {
   "id": "J1",
   "partA": "new-002",
   "partB": "new-001",
   "mate": "face",
   "clearance_mm": 0.15,
   "note": "upper/forearm hollow link ↔ base/shoulder"
  },
  {
   "id": "J2",
   "partA": "new-003",
   "partB": "new-002",
   "mate": "face",
   "clearance_mm": 0.15,
   "note": "elbow/wrist joint cartridge ↔ link"
  },
  {
   "id": "J3",
   "partA": "new-005",
   "partB": "new-002",
   "mate": "snap",
   "clearance_mm": 0.3,
   "note": "external replaceable cable spine clip"
  },
  {
   "id": "J4",
   "partA": "new-004",
   "partB": "new-003",
   "mate": "face",
   "clearance_mm": 0.15,
   "note": "tool flange service module bolts onto wrist joint module"
  }
 ],
 "hardware_bom": [
  {
   "standard": "M4",
   "qty": 4
  },
  {
   "standard": "M3",
   "qty": 10
  }
 ]
}