{
 "version": "bp-assembly-v1",
 "target": "small_launch_vehicle",
 "fasteners": [
  {
   "id": "F1",
   "standard": "M3",
   "kind": "screw",
   "length_mm": 10,
   "qty": 8,
   "anchor": "corners_4",
   "joins": [
    "new-001",
    "new-002"
   ],
   "hole": "clearance",
   "torque_Ncm": 45,
   "note": "alignment keys locate tank/flow-path module to body segments (boss ×8)"
  },
  {
   "id": "F2",
   "standard": "M3",
   "kind": "screw",
   "length_mm": 6,
   "qty": 4,
   "anchor": "face_+X",
   "joins": [
    "new-004",
    "new-001"
   ],
   "hole": "clearance",
   "torque_Ncm": 40,
   "note": "avionics service cover (interstage ring)"
  }
 ],
 "joints": [
  {
   "id": "J2",
   "partA": "new-002",
   "partB": "new-001",
   "mate": "slot",
   "clearance_mm": 0.3,
   "note": "tank/flow-path slide module"
  },
  {
   "id": "J3",
   "partA": "new-003",
   "partB": "new-001",
   "mate": "slot",
   "clearance_mm": 0.3,
   "note": "removable engine display cartridge (boss guide)"
  },
  {
   "id": "J4",
   "partA": "new-005",
   "partB": "new-001",
   "mate": "press",
   "clearance_mm": 0.25,
   "note": "fairing / fin replaceable"
  },
  {
   "id": "J5",
   "partA": "new-004",
   "partB": "new-001",
   "mate": "face",
   "clearance_mm": 0.2,
   "note": "indexed interstage/avionics ring keys onto cutaway core alignment features"
  }
 ],
 "hardware_bom": [
  {
   "standard": "M3",
   "qty": 12
  }
 ]
}